{"$schema":"https://json-schema.org/draft/2020-12/schema","type":"object","additionalProperties":false,"required":["schema_version","order_id","hypothesis_id","mode","evidence_tier","edge_claim","source_binding","validation_seal","authorizations","access_counts","lifecycle","outcome","metric_statistics"],"properties":{"schema_version":{"const":"lily_l4_b88_scientific_report_v1"},"order_id":{"const":"B8.8"},"hypothesis_id":{"const":"L-4"},"mode":{"enum":["synthetic_fixture","future_falsification_only"]},"evidence_tier":{"enum":["E0","E1"]},"edge_claim":{"const":"none"},"source_binding":{"type":"object"},"validation_seal":{"type":"object"},"authorizations":{"type":"object"},"access_counts":{"type":"object"},"lifecycle":{"type":"object"},"outcome":{"enum":["blocked_before_activation","scope_restricted","falsified_E1_only","not_falsified_not_validated_E1"]},"metric_statistics":{"type":"object"}}}
