{"schema_version":"lily_l4_b88_scientific_report_v1","order_id":"B8.8","hypothesis_id":"L-4","mode":"synthetic_fixture","evidence_tier":"E0","edge_claim":"none","source_binding":{"gate_path":"experiments/l_4_breadth_b88_phase_a_execution_contract_v1.json","gate_sha256":"c029e229b6c3f8d69c351fab8c5664d3d3a04ec12c23920a16387d3cc60209b7"},"validation_seal":{"status":"sealed_not_accessed","accessed":false},"authorizations":{"data":false,"container":false,"market":false,"return":false,"signal":false,"position":false,"covariance":false,"regime":false,"cost":false,"pnl":false,"validation":false,"provider":false,"network":false,"credentials":false,"broker":false,"paid":false,"paper_trade":false,"real_money":false,"activation":false,"execution":false,"report":false,"research_decision":false,"ledger":false},"access_counts":{"activation_count":0,"production_execution_count":0,"production_report_count":0,"ledger_count":0,"real_container_read_hash_scan_count":0,"market_return_signal_position_covariance_regime_cost_pnl_count":0,"validation_access_count":0,"provider_network_credentials_broker_paid_paper_real_money_count":0},"lifecycle":{"activation_schema_version":"lily_l4_b88_scientific_execution_activation_v1","owner_reference":"B8.8 Phase A owner authorization","committed_bootstrap_required":true,"one_shot_required":true,"activation_present":false},"outcome":"blocked_before_activation","metric_statistics":{}}
